{
  "schema_version": "1.0.0",
  "dataset": "Keepnet UK pleasure fisheries seed",
  "as_of": "2026-10-04",
  "scope": "Researched seed list of public/day-ticket recreational freshwater fisheries; not exhaustive.",
  "record_count": 64,
  "country_counts": {
    "England": 40,
    "Northern Ireland": 8,
    "Scotland": 8,
    "Wales": 8
  },
  "coordinate_precision_counts": {
    "postcode_centroid": 19,
    "unknown": 29,
    "venue_map_pin": 2,
    "official_venue_point": 1,
    "official_location_pin": 1,
    "official_map_centre": 5,
    "official_venue_pin": 1,
    "official_waterbody_pin": 1,
    "published_venue_pin": 5
  },
  "coordinate_reference_system": "WGS84 longitude/latitude, EPSG:4326",
  "unknown_coordinates": "null in JSON; blank in CSV; omitted from GeoJSON",
  "records": [
    {
      "id": "eng-hallcroft-fishery",
      "name": "Hallcroft Fishery",
      "country": "England",
      "region": "East Midlands",
      "nearest_town": "Retford",
      "address": "Hallcroft Road, Retford, Nottinghamshire",
      "postcode": "DN22 7RA",
      "postcode_geocoding_allowed": true,
      "postcode_notes": null,
      "latitude": 53.335174,
      "longitude": -0.95409,
      "coordinate_precision": "postcode_centroid",
      "coordinate_source_url": "https://api.postcodes.io/postcodes/DN227RA",
      "coordinate_checked_on": "2026-10-04",
      "postcode_location_quality": 1,
      "needs_pin_review": true,
      "has_coordinates": true,
      "website": "https://jamesparks.co.uk/hallcroft-fisheries/",
      "access_type": "day_ticket",
      "fishery_type": "coarse_lakes_and_river",
      "species": [
        "carp",
        "bream",
        "perch",
        "roach",
        "pike",
        "barbel",
        "chub"
      ],
      "access_notes": "Daily and evening pleasure-angling tickets are advertised. The venue includes lakes and a stretch of the River Idle; check applicable water and match restrictions before fishing.",
      "source_url": "https://jamesparks.co.uk/fishing-with-us/fishing-tarifs/",
      "source_urls": [
        "https://jamesparks.co.uk/hallcroft-fisheries/",
        "https://jamesparks.co.uk/fishing-with-us/fishing-tarifs/"
      ],
      "address_source_url": null,
      "species_source_url": null,
      "last_checked": "2026-10-04",
      "verification_notes": "Official-source research checked on the stated date; operating status, booking availability and map entrance not independently confirmed."
    },
    {
      "id": "england-barford-lakes",
      "name": "Barford Lakes",
      "country": "England",
      "region": "East of England",
      "nearest_town": "Norwich",
      "address": "Chapel Street, Barford, Norwich, Norfolk",
      "postcode": "NR9 4BJ",
      "postcode_geocoding_allowed": true,
      "postcode_notes": null,
      "latitude": null,
      "longitude": null,
      "coordinate_precision": "unknown",
      "coordinate_source_url": null,
      "coordinate_checked_on": null,
      "postcode_location_quality": null,
      "needs_pin_review": true,
      "has_coordinates": false,
      "website": "https://www.barfordlakes.com/",
      "access_type": "day_ticket",
      "fishery_type": "coarse_lakes",
      "species": [
        "carp",
        "bream",
        "tench",
        "golden orfe",
        "crucian carp",
        "chub",
        "roach",
        "rudd"
      ],
      "access_notes": "This row covers the main Barford complex. Day-ticket pleasure fishing is advertised, but the homepage limits public day-ticket days and carries older notices; confirm the current schedule.",
      "source_url": "https://www.barfordlakes.com/asp_pages/lakes_pleasurelake.asp",
      "source_urls": [
        "https://www.barfordlakes.com/",
        "https://www.barfordlakes.com/asp_pages/lakes_pleasurelake.asp",
        "https://www.barfordlakes.com/asp_pages/contact.asp",
        "https://www.barfordlakes.com/asp_pages/lakes.asp"
      ],
      "address_source_url": null,
      "species_source_url": null,
      "last_checked": "2026-10-04",
      "verification_notes": "Official-source research checked on the stated date; operating status, booking availability and map entrance not independently confirmed. No coordinate pair is supplied; keep off the map until verified."
    },
    {
      "id": "england-colemans-cottage-fishery",
      "name": "Colemans Cottage Fishery",
      "country": "England",
      "region": "East of England",
      "nearest_town": "Witham",
      "address": "Little Braxted Lane, Witham, Essex",
      "postcode": "CM8 3EX",
      "postcode_geocoding_allowed": true,
      "postcode_notes": null,
      "latitude": null,
      "longitude": null,
      "coordinate_precision": "unknown",
      "coordinate_source_url": null,
      "coordinate_checked_on": null,
      "postcode_location_quality": null,
      "needs_pin_review": true,
      "has_coordinates": false,
      "website": "https://www.colemansfishery.co.uk/",
      "access_type": "day_ticket",
      "fishery_type": "coarse_lakes",
      "species": [
        "carp",
        "F1 carp",
        "bream",
        "roach",
        "ide",
        "tench",
        "rudd",
        "perch",
        "crucian carp"
      ],
      "access_notes": "Check in at the tackle shop before fishing. No public day tickets on Wednesdays unless staying onsite; Cottage Lake is a member water.",
      "source_url": "https://www.colemansfishery.co.uk/fishing/",
      "source_urls": [
        "https://www.colemansfishery.co.uk/",
        "https://www.colemansfishery.co.uk/fishing/"
      ],
      "address_source_url": null,
      "species_source_url": null,
      "last_checked": "2026-10-04",
      "verification_notes": "Official-source research checked on the stated date; operating status, booking availability and map entrance not independently confirmed. No coordinate pair is supplied; keep off the map until verified."
    },
    {
      "id": "england-decoy-lakes",
      "name": "Decoy Lakes",
      "country": "England",
      "region": "East of England",
      "nearest_town": "Whittlesey",
      "address": "351 Drybread Road, Whittlesey, Peterborough, Cambridgeshire",
      "postcode": "PE7 2AD",
      "postcode_geocoding_allowed": true,
      "postcode_notes": null,
      "latitude": 52.5651986,
      "longitude": -0.0974607,
      "coordinate_precision": "venue_map_pin",
      "coordinate_source_url": "https://www.google.co.uk/maps/place/Decoy+Lakes/@52.5652018,-0.1000356,17z/data=!3m1!4b1!4m6!3m5!1s0x4877fc829ff341f9:0xbbf53091897b9cb8!8m2!3d52.5651986!4d-0.0974607!16s%2Fg%2F1th5hzd7?entry=ttu",
      "coordinate_checked_on": "2026-10-04",
      "postcode_location_quality": null,
      "needs_pin_review": false,
      "has_coordinates": true,
      "website": "https://www.decoylakes.co.uk/",
      "access_type": "day_ticket",
      "fishery_type": "coarse_lakes",
      "species": [
        "carp",
        "F1 carp",
        "tench",
        "barbel",
        "crucian carp",
        "roach",
        "rudd"
      ],
      "access_notes": "Day-ticket match and pleasure complex. The site says no day tickets are sold after 11am; check the current arrival window and lake availability. Use the contact address and official map, as another section lists a different street number.",
      "source_url": "https://www.decoylakes.co.uk/",
      "source_urls": [
        "https://www.google.co.uk/maps/place/Decoy+Lakes/@52.5652018,-0.1000356,17z/data=!3m1!4b1!4m6!3m5!1s0x4877fc829ff341f9:0xbbf53091897b9cb8!8m2!3d52.5651986!4d-0.0974607!16s%2Fg%2F1th5hzd7?entry=ttu",
        "https://www.decoylakes.co.uk/"
      ],
      "address_source_url": null,
      "species_source_url": null,
      "last_checked": "2026-10-04",
      "verification_notes": "Official-source research checked on the stated date; operating status, booking availability and map entrance not independently confirmed."
    },
    {
      "id": "england-hintlesham-fisheries",
      "name": "Hintlesham Fisheries",
      "country": "England",
      "region": "East of England",
      "nearest_town": "Ipswich",
      "address": "Fenn Farm, Hadleigh Road, Burstall, Ipswich, Suffolk",
      "postcode": "IP8 3EG",
      "postcode_geocoding_allowed": true,
      "postcode_notes": null,
      "latitude": null,
      "longitude": null,
      "coordinate_precision": "unknown",
      "coordinate_source_url": null,
      "coordinate_checked_on": null,
      "postcode_location_quality": null,
      "needs_pin_review": true,
      "has_coordinates": false,
      "website": "https://hf.areafish.com/",
      "access_type": "day_ticket",
      "fishery_type": "coarse_lakes",
      "species": [
        "carp",
        "catfish",
        "tench",
        "perch",
        "roach",
        "rudd",
        "crucian carp",
        "bream"
      ],
      "access_notes": "The site advertises a day-ticket fishery with a mixed-stock Match Lake and separate specimen waters. Call to confirm session availability and booking rules.",
      "source_url": "https://hf.areafish.com/",
      "source_urls": [
        "https://hf.areafish.com/",
        "https://hf.areafish.com/contact/",
        "https://hf.areafish.com/about/"
      ],
      "address_source_url": null,
      "species_source_url": null,
      "last_checked": "2026-10-04",
      "verification_notes": "Official-source research checked on the stated date; operating status, booking availability and map entrance not independently confirmed. No coordinate pair is supplied; keep off the map until verified."
    },
    {
      "id": "england-newland-hall-fishery",
      "name": "Newland Hall Fishery",
      "country": "England",
      "region": "East of England",
      "nearest_town": "Chelmsford",
      "address": "The Lodge, Newland Hall Country Estate, Bishops Stortford Road, Roxwell, Chelmsford, Essex",
      "postcode": "CM1 4LH",
      "postcode_geocoding_allowed": true,
      "postcode_notes": null,
      "latitude": null,
      "longitude": null,